,id,job_title,description,location,employer,date_posted,n_applicants,industries,industries_1,industries_2,employment_type,job_function,job_function_1,seniority_level
2,2416156266,BI / Business Analyst (m/w/d)  – in München ,"Du bist Business Analyst mit ganzem Herzen und hast Lust uns bei der Datenanalyse zu unterstützen? Du möchtest Business Partner sein und Stakeholder mit deinen Insights unterstützen? Die Qualität deiner Auswertungen sind dir dabei extrem wichtig? Dann werde Teil unseres Teams!IMPACT THE PRIVACY ERA. BECOME A GUARD.Wir sind ein aufstrebendes und ambitioniertes Datenschutz- und Compliance-Unternehmen aus dem Herzen Münchens. Mit unserer innovativen Kombination aus persönlicher Betreuung und einer selbst entwickelten, patentierten Online-Plattform bieten wir Unternehmen Datenschutz als maßgeschneiderten Rundumservice. Nach fast 3 Jahren sind wir einer der bundesweit führenden Anbieter und bereits über 1.500 nationale und internationale Kunden aus über 430 Städten setzen auf unsere umfassende Lösung. Aufbauend auf dieser Erfolgsgeschichte, expandieren wir in weitere Märkte.Du für uns:Du schaffst es schnell und präzise Dashboards zu erstellen und verlierst hier niemals den Fokus auf die Qualität Du führst Ad-Hoc Analysen durch und stellst diese deinen und unseren internen Kunden als Entscheidungsvorlage zur Verfügung Du optimierst und entwickelst bestehende sowie neue Prozesse und erstellst dabei spannende Insights mit Blick auf die gängigen SaaS Kennzahlen Du führst Projekte und glänzt hier durch deine Professional-SkillsWir für dich: Rasant wachsendes und dynamisches B2B-/SaaS-Unternehmen mit Start-up-Flair Internationales Team aus über 150 ambitionierten Kollegen Positive und professionelle Arbeitsatmosphäre sowie hohe persönliche Wertschätzung Steile Lernkurve mit nahezu unbegrenztem EntwicklungspotenzialProfessionelles Onboarding und kontinuierliche Weiterbildungsmöglichkeiten Flache Hierarchien, viel Verantwortung und Fokus auf individuelle Ownership Flexible Arbeitszeiten, kostenlose Fitnessstudio-Mitgliedschaft und täglich frisches Obst/Snacks Regelmäßige Teamevents, gemeinsame Ausflüge und „Einer für alle, alle für einen“-Mentalität positiv, respektvoll, ungezwungen – und hochprofessionell! Gepaart mit einem hervorragenden Teamzusammenhalt, Diversität und persönlicher Wertschätzung wirst Du dich von Anfang an wohl fühlenDas brauchst du in deiner Rolle als Guard:Muss: Top Kenntnisse in einem BI-Tool (Tableau, PowerBI oder QlickView) sind für diese Stelle ein absolutes Muss Abgeschlossenes Studium mit Schwerpunkt Wirtschaftsinformatik, Informatik, Business Analytics Du hast bestenfalls auch schon 2 Jahre praktische Erfahrung sammeln Du bringst zudem eine gewisse Routine im Umgang mit komplexen Datensätzen mit Sehr gute Kenntnisse in MS Office mit Fokus auf das Excel Paket Du hast einen Klaren Kopf, das Herz am rechten Fleck, Leistungsbereitschaft und das gewisse Urteilsvermögen Du beherrschst Deutsch auf muttersprachlichem Niveau und kannst zudem mit sehr guten Englischkenntnissen in Wort und Schrift überzeugen Zu guter Letzt bringst du eine ausgeprägte Leidenschaft für Datenanalyse mit und dir ist bewusst, welchen Unterschied eine gute BI für ein Unternehmen erbringen kann﻿Ein paar letzte Worte. Ehrlich und von Herzen.Unabhängig von deiner Herkunft, Ethnie, Geschlechtsidentität, Religion oder deinen individuellen Voraussetzungen: Bei uns zählt das, was hinter dem Menschen steckt. Als Guards verbindet uns neben unserer Hingabe nämlich eine Sache. Und das ist unsere Einzigartigkeit. Überzeuge uns mit deiner Persönlichkeit und deinen Skills – und wir werden die beste Zeit haben und gemeinsam große Dinge tun! Show moreShow lessSeniority levelEntry levelEmployment typeFull-timeJob functionFinanceAnalystIndustriesInformation Technology and Services",Greater Munich Metropolitan Area,DataGuard ,2021-05-12,0,Information Technology and Services,,,Full-time,Finance,Analyst,Entry level
3,2542271942,"Big Data, Analytics and Artificial Intelligence Expert (m/w/x)","IHRE ROLLESie optimieren Prozesse zwischen Business, Strategie und IT durch Einsatz von Data Science Methoden & Machine learning und bilden damit das Bindeglied zwischen Daten und ProjektBusiness Innovation: Sie konzeptionieren und implementieren innovative, datengetriebene Geschäftsmodelle und identifizieren, konzeptionieren und bewerten klientenspezifische Use Cases durch Einsatz von Datenmodellierung und -analyseBig Data & Analytics: Durch Anbindung unterschiedlicher Datenquellen sowie Konzeption analytischer Applikationen ermöglichen Sie wertvolle Einblicke in unternehmensrelevante ZusammenhängeDigital Transformation: Sie konzipieren und setzen Unternehmenstransformationen sowie Strategie- und Prototypenentwicklung bis hin zu „Data Driven Business“ um unter Einsatz geeigneter Werkzeuge des Machine LearningProjektarbeit: Sie arbeiten in einem agilen und kompetenten Team und tragen fachlich zur übergreifenden Programm- und Projektsteuerung bei bzw. sind entscheidend bei der Erreichung der ProjektzieleIHR PROFILStudium in einem MINT-Fach, Wirtschaftsinformatik, Wirtschafts-wissenschaften oder eine äquivalente Qualifikation sowie mehrjährige praktische Projekterfahrung unter Anwendung von Data Science Methoden oder Artificial IntelligencePraktische Erfahrung mit statistischen Methoden oder Machine Learning, die auf einen oder (im Idealfall) mehrere der folgenden Anwendungsfälle angewendet werden: Natural Language Processing (z.B. Text-Mining, Training von Chatbots), Transaktions- oder Kundenanalyse im Finanzumfeld, Fraud Detection, Robotik oder Echtzeit-Datenanalyse von Data StreamsSehr gute Deutsch- und Englischkenntnisse in Wort und Schrift sowie die Bereitschaft zu reisenUNSER ANGEBOTBei CORE sind Sie Teil einer leistungsbereiten und leistungsfähigen Unternehmenskultur mit höchsten AmbitionenZusammenarbeit mit Persönlichkeiten in heterogenen und interna-tionalen TeamsHerausforderungen und Verantwortung bei der Arbeit, gepaart mit Begeisterung für Ergebnisse und transparente KommunikationEine Kultur, die Sie dazu animiert, eigene Ideen einzubringen und umzusetzen, es gilt der Grundsatz – „Competence leads“Regelmäßige Schulungen sowie zahlreiche Benefits und Services, die den Arbeitsalltag erleichternShow moreShow lessSeniority levelEntry levelEmployment typeFull-timeJob functionInformation TechnologyIndustriesInformation Technology and ServicesComputer SoftwareManagement Consulting","Berlin, Berlin, Germany",CORE SE,2021-05-10,0,Information Technology and Services,Computer Software,Management Consulting,Full-time,Information Technology,,Entry level
4,2349021066,Consultant (m/w/d) - Data Analytics & Business Insights,"Financial Advisory Analytics bietet auf unsere Mandanten zugeschnittene Produkte und datengetriebene Lösungen an. Unser multidisziplinäres und internationales Team berät mit einem ganzheitlichen Ansatz bei analytischen Fragestellungen im Kontext von Unternehmenstransaktionen oder -restrukturierungen sowie der Durchführung von Financial, Commercial und Tax Due Diligences. Mithilfe von Advanced Analytics und Data Science unterstützen wir unsere Kunden ihre Big-Data-Herausforderungen zu strukturieren, Handlungsbedarfe zu identifizieren und Entscheidungen datenbasiert zu treffen.Für unsere Teams an den Standorten Düsseldorf, Frankfurt und München suchen wir engagierte Verstärkung.Spannende Aufgaben erwarten SieBeraten Sie namhafte, international agierende Unternehmen bei Mergers & Acquisitions, in dem Sie relevante Fragestellungen mithilfe neuester Technologien analysieren und beantworten. Bringen Sie darüber hinaus Ihre Kreativität und Ihr Fachwissen bei der Weiterentwicklung dieser Tools mit ein, um die Effizienz künftiger Kundenprojekte weiter zu steigern.Wie können Sie sich den Arbeitsalltag in unserem Team vorstellen?Sie entwickeln geeignete Algorithmen und Verfahren zur Aufbereitung und Verknüpfung entscheidungsrelevanter DatenSie identifizieren Zusammenhänge und Muster in den Daten, um Ihre aufgestellten Hypothesen zu prüfen und konzeptionieren auf Ihre Kunden zugeschnittene Dashboards unter Einsatz von Business-Intelligence-ToolsSie generieren gemeinsam mit Data-Science-Experten weitere Insights durch die Nutzung von Advanced Analytics und Machine Learning und kommunizieren datengetriebene Entscheidungsvorlagen an ausgewählte StakeholderSie arbeiten mit den neuesten Tools und Methoden und arbeiten sich in neue Themen und Technologien ein, um Ihr Wissen kontinuierlich zu erweiternDarin sind Sie SpezialistIhre Studienschwerpunkte in Wirtschaftswissenschaften, Statistik, Data Analytics oder anderen einschlägigen Bereichen und ein überdurchschnittlicher Masterabschluss demonstrieren Ihre analytischen FähigkeitenSie verfügen über ein fundiertes betriebswirtschaftliches Fachwissen, vorzugsweise in Corporate Finance und AccountingSie bringen erste Programmierkenntnisse in R, Python, SQL oder Vergleichbarem mit, idealerweise im Zusammenspiel mit Business-Intelligence-Tools wie Power BI oder Qlik SenseSie konnten bereits praktische Erfahrungen im Umgang mit großen Datenmengen sammelnSie zeichnet ein hohes Maß an Selbstständigkeit, Engagement, kreativem Denkvermögen und Teamgeist ausSie verfügen über sehr gute Englischkenntnisse - Deutschkenntnisse sind nicht zwingend erforderlichWas Sie von uns erwarten könnenNeben einer angenehmen, kollegialen Atmosphäre bieten wir Ihnen ein chancenreiches, internationales Arbeitsumfeld. Bei uns gelten flache Hierarchien und ein Prinzip der offenen Tür. Ein weiterer Pluspunkt: Dank einer Vielzahl von Weiterbildungsprogrammen bringen wir Sie in Ihrer beruflichen und persönlichen Entwicklung einen großen Schritt nach vorn.Sie sind interessiert? Wir freuen uns auf SieBitte richten Sie Ihre Bewerbung an das Deloitte Recruiting-Team.Die Inklusion von Menschen mit Behinderung entspricht unserem Selbstverständnis und wir begrüßen daher Ihre Bewerbung. Bitte haben Sie Verständnis dafür, dass wir aufgrund der geltenden Datenschutzgrundverordnung ausschließlich Online-Bewerbungen über unser Recruiting-Management-System entgegennehmen können.Bei Fragen rund um das Thema Bewerbung bei Deloitte helfen Ihnen unsere FAQs schnell weiter. Unsere Bewerbungshinweise geben Ihnen konkrete Ratschläge zur erfolgreichen Bewerbung über unser Online-Portal:⇒ FAQs⇒ BewerbungshinweiseWhat impact will you make?Job-ID: 226Show moreShow lessSeniority levelEntry levelEmployment typeFull-timeJob functionConsultingInformation TechnologySalesIndustriesManagement Consulting","Düsseldorf, North Rhine-Westphalia, Germany",Deloitte Deutschland,2021-10-14,36 applicants,Management Consulting,,,Full-time,Consulting,Information Technology,Entry level
0,2539086384,Analytics Engineer - Product (m/f/d),"THIS IS USBasically we’re changing how a city breathes and moves with sustainable and innovative ways to improve urban travel options for everyone. We’re on a one-way trip to create a world with less pollution, less traffic jams and more ways to explore your city without leaving an impact. Climate-neutral TIER Mobility is Europe’s leading provider of micro-mobility, with a mission to change mobility for good.Since we opened our doors in October 2018, 95+ cities have chosen us across 14 markets. More than 500+ people have joined us on our mission to change mobility for good. In November 2020, TIER successfully raised $250m in Series C funding to accelerate our ambitious plans, with investors such as SoftBank, Mubadala Capital, Northzone, and Goodwater Capital.We are paving the way for clean and enjoyable ways to travel and we’d love for you to join the ride.Permanent employee, Full-timeTHE ROLE AND YOUR IMPACT AT TIER You will join the Product Analytics team, helping to develop & curate a best in class data platform for our cross functional Product teams Your main focus will be integrating new data sources into our data warehouse and developing highly scalable & performant data models which enable our Product teams to generate business critical insights, analyses, and dashboards You will ensure that data is modelled to the highest standards, is well documented and accessible to different end users through the appropriate platforms (e.g. directly through Snowflake, Looker, Amplitude...) You will collaborate closely with embedded Product Analysts & their respective teams, helping to prioritise data projects & translate business requirements into technical plans. You will support Product Analysts with expert technical advise at each stage of the data lifecycle, from defining new tracking events to data model structure & design. You will develop data best practices, standards & guidelines for the wider Data Analytics team and put in place effective strategies to ensure they are followed You will proactively identify areas for improvement in the data platform (e.g. areas of repeated maintenance, data quality issues or recurring ad-hoc requests) and propose ideas to address them You’ll Fit Great With These Skills And Qualifications At least 3 years of experience in data modelling and/or analysis. You have experience working with data exploration and modelling platforms such as Looker, Periscope or Tableau and worked on data transformations ideally through DBT Experienced in advanced data modelling - you can take raw data from different event generating sources and turn that into optimised data model that scales well with at high volumes. Advanced SQL skills - you can solve the problem with most efficient SQL considering the underlying data warehouse, data volume and loading methods Experience modelling mobile tracking data and working alongside cross functional Product teams is a big plus. You can communicate complex problems with technical and business users in simple language You are structured at work, able to handle and prioritise your tasks well in an ambiguous environment. GET AN IMPRESSION OF THE TEAMWe are a diverse team of Data Engineers, Analytics Engineers, Data Analysts and Data Scientists helping TIER advance in all things data. We are from 10 different nations and like to geek out on different data stacks and technologies. We strive to build great data infrastructure and enable teams across TIER to take data-informed decisionsTHIS MAY INSPIRE YOU Join us at the forefront of one of the most exciting and rapidly moving industries  We’re agile, we’re growing and so will you! At TIER, there’s space for exponential professional development and room to make a huge impact on the business going forward Being part of the team means you’re part of its success. Our ESOP program gives you an opportunity to have a share in the company – nothing like invested interest! We appreciate your talent and support your growth with an annual development budget Surf your city with free rides on our e-scooters and e-mopeds Diversity and inclusivity is super important to us, so enjoy initiatives and programs such as #WomenofTIER Expect company onboarding and team events with international colleagues from all over the world Benefit from flexible hours and our work from home policy Enjoy amazing views at our centrally located office at Potsdamer Platz, with a variety of different restaurants and great transport connections We actively encourage a diverse and inclusive environment that fosters each employee’s individuality at TIER. We take affirmative action to ensure equal opportunity for your application, regardless to your nationality, ethnic or national origin, skin color, religion, disability, sex, sexual orientation or gender identity. Come as you are and join our ride!In case you are living with disabilities, chronic illness or neurodiversity please inform us, to provide you with the proper assistance in the application process.If we could spark your interest and you want to change mobility for good with us, apply now and let us know why you’re the one for the job! We encourage everyone to apply and grow with us. Even if you may not tick all the boxes of the requirements, we are happy to hear about the value you can add to the team. We are all learners!We are looking forward to your application!Show moreShow lessSeniority levelEntry levelEmployment typeFull-timeJob functionInformation TechnologyIndustriesInformation Technology and ServicesComputer SoftwareInternet","Berlin, Berlin, Germany",TIER Mobility,2021-05-13,0,Information Technology and Services,Computer Software,Internet,Full-time,Information Technology,,Entry level
1,2542346174,Marketing Business Intelligence Analyst—Analytics and Alumni Insights,"WHAT YOU'LL DOAs Business Intelligence Analyst with a focus on analytics and alumni insights, you’ll be part of our Marketing and Communications department and assume responsibility for data-driven marketing projects, focusing on former BCG colleagues. You’ll work closely with BCG Partners, practice area heads, the business development team, and the marketing leadership team, particularly with the Alumni Ambassador. Your core tasks will include defining relevant KPIs, measuring success from a marketing and business perspective, and deriving concrete recommendations for action for BCG to optimally maintain and develop alumni relations.You’ll report to the Marketing Intelligence Manger and work in close coordination with the Alumni Ambassador and Alumni Node to advance the analysis and usage of alumni data in Germany and Austria. Using your analytical and communicative skills, you’ll develop meaningful marketing dashboards, advance the interface of Marketing and Business Development and head innovative optimization initiatives in the area of analytics and alumni insights. That also includes advising the practice areas about what activities provide the most value in the communication between active BCGers and alumni and how those activities can be implemented to scale.YOU'RE GOOD ATYou’re able to read and interpret data and know what stories data can tell. You also have a knack for economic trends and business development and have a talent for communication. You’re curious about new tools and always like to look at new topics. Solving complex problems is your passion.You have a sharp analytical mind and you enjoy working with data.You’re interested in business topics and the German corporate landscape.You enjoy working on innovative projects. It’s important to you to push the boundaries together as a team and look beyond your horizons.It’s easy for you to drive multiple projects at a time, prioritizing as needed and involving the right contact people at the right time.You implement new ideas and even if there’s some resistance, you make a good impression with your professional manner.You have strong communication skills and are able to present complex issues in a clear and concise way.YOU BRING (EXPERIENCE & QUALIFICATIONS)Data nerd and communication talent, business developer and networker—those aren’t a contradiction to you. You have marketing-experience and know how to distill business-relevant insights from data analyses to make them accessible and understandable for colleagues of other departments.You have completed a college degree, ideally in the field of statistics, business administration, computer science, or marketing/communications (with a focus on data analysis).You have initial work experience in market research, business development, marketing, and/or data analysis.You can analyze data sets and have initial experience in data visualization.You have some experience in using CRM database systems and ideally with e‑mail tools.You are proficient in the MS Office package (especially PowerPoint and Excel, preferably including macros/VBA).Programming skills (SQL, R, C/C++, HTML) are an advantage.Your written and spoken German and English language skills are excellent.YOU'LL WORK WITHYou’ll be part of the German and Austrian Marketing Team and work closely with around 25 colleagues from three different locations, Munich, Düsseldorf, and Vienna. Additionally, you’ll be part of the center of excellence for the Alumni Ambassador and Alumni Node. Your Marketing Intelligence Manager will support you in learning the ropes and in your everyday work and professional development at the company. You will also always be able to draw on the experience of your coworkers.ADDITIONAL INFORMATIONAt BCG we care about our people and offer you a great package of different benefits*:Attractive and performance-based compensation package with fixed and variable components30 days of vacation, in addition to an attractive flexibility programAttractive insurance package and social security benefitsWide-ranging training programIndividual support by our Employee Assistance ProgramFitness offers in the office (e.g. Healthy Back lessons, Yoga, Zumba); discounts at selected gymsFree beverages and snacks (e.g. cereals, smoothies, yoghurt) and food vouchers for use with partners near the officeWide variety of office events (e.g. Christmas party, sport events, summer get-togethers, and other social events)Assumption of commuting costs up to a maximum amount*Benefits may vary slightly by locationJob SummaryJob number: 12562BRDate posted : 2021-05-11Profession: Marketing & CommunicationsEmployment type: Full timeShow moreShow lessSeniority levelEntry levelEmployment typeFull-timeJob functionMarketingSalesIndustriesMarketing and AdvertisingInformation Technology and ServicesComputer Software","München, Bavaria, Germany",<NOT_GIVEN>,2021-05-14,0,Marketing and Advertising,Information Technology and Services,Computer Software,Full-time,Marketing,Sales,Entry level
2,2532204771,Chief of Staff (m/w/d) Data Analytics,"Als Chief of Staff (m/w/d) Data Analytics sind Sie die zentrale Schnittstelle zwischen dem Management Team des Bereichs Data Analytics & Platform Solutions und einem interdisziplinären Team an Data Scientists, Data Engineering Experten und Beratern. Das Team wendet modernste Analytics Lösungen an und entwickelt Datentechnologien für interne wie externe Kunden.An der Seite des Managements koordinieren und gestalten Sie aktiv alle wesentlichen Aktivitäten und Prozesse dieser wachsenden Unit:Projektmanagement von internen Themen, e.g. Produktentwicklung, Themenpositionierung und organisatorische Weiterentwicklung der UnitEtablierung einer Schnittstelle zu den angrenzenden Bereichen und deren Beratungsteams, unseren internationalen Standorten sowie unseren Kunden weltweitVeröffentlichung von Blog-Artikeln, Studien-Publikationen und Standpunktpapieren rund um das Thema Data Analytics, Big Data & PlatformsInhaltliche und organisatorische Unterstützung in der Vorbereitung von Projekt-PitchesManagement des Akquise-Funnels, des Produkt- / Projekt-Angebots sowie die Vorbereitung von Akquise-TerminenÜbernahme von Ad-hoc-Aufgaben für das Management Team der UnitVerantwortung für eigene interne Projekte im Bereich Business Development, Sales und ThemenentwicklungQualifikationenSehr gut abgeschlossenes Universitätsstudium (Bachelor oder Master), idealerweise mit Studienschwerpunkt Data Analytics, Big Data oder MarketingPraktika oder erste berufliche Erfahrung in den Bereichen Consulting, Business Intelligence bzw. Data Analytics, Marketing oder Kommunikation sind von VorteilStarke analytische Fähigkeiten sowie eine schnelle AuffassungsgabeHohes Maß an Eigeninitiative und Qualitätsbewusstsein sowie eine äußerst strukturierte und selbstständige ArbeitsweiseOrganisationsstärke und Projektmanagement-FähigkeitenProfessionelles, verbindliches Auftreten und zielgruppenspezifische KommunikationSehr gute Deutsch- und Englischkenntnisse in Wort und SchriftSouveräner Umgang mit dem gesamten MS Office PaketZusätzliche InformationenHaben wir Ihr Interesse geweckt?Wir freuen uns auf Ihre vollständigen Bewerbungsunterlagen (Anschreiben, Lebenslauf, Abiturzeugnis, Zeugnisse aller Studienabschlüsse, sämtliche Praxiszeugnisse inkl. Praktika sowie Nachweise über Auslandsaufenthalte) über unser Online-Bewerbungsformular.Show moreShow lessSeniority levelEntry levelEmployment typeFull-timeJob functionMarketingIndustriesManagement Consulting","Munich, Bavaria, Germany",Roland Berger,2021-05-12,0,Management Consulting,,,Full-time,Marketing,,Entry level
