,id,job_title,description,location,employer,date_posted,n_applicants,industries,industries_1,industries_2,employment_type,job_function,job_function_1,seniority_level
2,2542344307,Data Scientist (m/w/d),"Wir suchen für unsere Tochterfirma Innoplexia am Standort Heidelberg zum nächstmöglichen Zeitpunkt eine/nData Scientist (m/w/d)Job search done. ME@SNPSeit 25 Jahren steht SNP für innovative Software und erstklassige Beratung im SAP-Umfeld. Unsere Expertenteams führen an Standorten weltweit selbst komplexeste Veränderungen in SAP-Landschaften schnell und effizient durch, um Agilität und Wettbewerbsfähigkeit unserer Kunden in globalen Märkten zu sichern. Know-how aus über 10.000 Transformationsprojekten, hochautomatisierte Softwarelösungen und das unschlagbare SNP-Team sind unsere Stärke. Eine enge, bereichs- und standortübergreifende Zusammenarbeit macht SNP zu einem besonderen Arbeitsplatz, der viel Abwechslung und ausgezeichnete Karrierechancen bietet.Wir suchen für unsere Tochterfirma Innoplexia am Standort Heidelberg zum nächstmöglichen Zeitpunkt eine/nData Scientist (m/w/d)AufgabenBearbeiten vielfältiger analytischer Fragestellungenunserer Kunden durch datengetriebene AnalysenErarbeitung und Anwendung von Machine LearningAlgorithmen, um Muster sowie Entwicklungen in Datenzu identifizierenMitarbeit in Advanced-Analytics ProjektenAbleitung konkreter Handlungsempfehlungen für unterschiedlichste KundenProfilMathematisches oder naturwissenschaftliches Studium, gerne mit PromotionLeidenschaft für Machine Learning und Data Science sowie eine analytisch geprägte DenkweiseErfahrung im Umgang mit großen und heterogenenDatenmengenKenntnisse in mindestens einer Programmiersprache (z.B. Python, R, Java, SQL)Sehr gute Kenntnisse in Deutsch oder EnglischBenefitsStart-Up-Kultur und lockeres Miteinander in Verbindung mit der Sicherheit eines großen UnternehmenFlexible ArbeitszeitenBetriebliche AltersvorsorgeStandortbezogenes SportangebotIndividuelles WeiterbildungsangebotKostenfreie Getränke und ObstTischkickern vor OrtBetreuungszuschuss für nichtschulpflichtige KinderFirmen- und TeameventsCorporate Benefit Programm1x wöchentlich Buffet am StandortEis aus unserer EismaschineWeitere Argumente für einen Einstieg bei Innoplexia auf .Wir freuen uns auf vollständige Bewerbungsunterlagen unter Angabe der Gehaltsvorstellung und des gewünschten Eintrittstermins.Sarah Pfeil Recruiting Specialist 06221 6425-168 SNP Schneider-Neureither & Partner SE Personalwesen Postfach 105080 69040 HeidelbergShow moreShow lessSeniority levelEntry levelEmployment typeFull-timeJob functionEngineeringInformation TechnologyIndustriesInformation Technology and ServicesComputer SoftwareStaffing and Recruiting","Heidelberg, Baden-Württemberg, Germany",SNP Schneider-Neureither & Partner SE,2021-05-14,0,Information Technology and Services,Computer Software,Staffing and Recruiting,Full-time,Engineering,Information Technology,Entry level
3,2542275652,Data Scientist (f/m/d),"We here at plista are looking for a new Data Scientist (m/f/d) to join our team. The data science team handles our internal and external clients’ data needs, builds machine learning services and develops our content recommendation engine. We are looking for a colleague that has a deep understanding of the methods and methodologies involved in machine learning, has the knowledge to build systems on a global scale in the cloud and is not shy to bring their own ideas and projects toimprove our current state of the art. You will be working in a cross-functional squad in bi-weekly Scrum sprints, there will be lots of opportunities to interact with colleagues and learn with them to develop yourself and improve your skills.Your Responsibilityplan, develop and deploy machine learning services on top of our current BI solutiohelp improve our content recommendation engine by creating new recommendation algorithms, test new features and presenting your findingsprovide analyses and visualizations of the data to our internal stakeholdershelp provide a data basis for decisions for new projectsYour QualificationStrong knowledge of Machine Learning, Artificial IntelligenceKnowledge of data modeling, algorihm design and ETL processesExperience with BI Systems (PowerBI, Tableau or similar)Knowledge of SQL, Python, bonus points for PHP, Scala, TerraformKnowledge of software engineering principles, git, agile team workUniversity degree in Computer Science, Statistics, Mathematics, Physics or any other subjects with a mathematical/statistical focus, alternatively three years of work experience in a related fieldDo you want to know more about our tech-stack? Please follow this link: https://stackshare.io/plista-gmbh/plista-gmbhWhat We OfferFlexible working hours on a trust basis (currently 100% remote work, following Corona also high flexibility)30 days of vacation - During Christmas and New Years we close the officeNumerous employee discounts through our parent companySocial Days - 1 day per quarter you can get involved in social projectsBe who you are - We have no dress code, wear what you feel comfortable inFast and powerful hardware Dedicated hack time for personal development and fun-projectsWe have in-house IT - Your computer problems will be solved on the same daySustainability - We support various charitable projects that promote human rights, integration, education, etc.Free fresh fruit and drinks in the office Extensive training and development opportunities, such as the plista Academy, as well as ongoing leadership developmentA dedicated and friendly team with a passion for new technologies and mediaFast decision-making processes, flat hierarchies and an open corporate cultureOnline sports offers such as yoga and meditationA family-friendly company with a company daycare centerRegular team events - After Corona also finally in person againA beautiful and modern office in the heart of Berlin-Mitte with plenty of space for creative work and many green plants for a feel-good atmosphereWho We Areplista’s was founded in 2008 and our native ad formats stand out through their strong engagement character and enable advertisers to efficiently target audiences along the entire sales funnel. At the same time, thousands of premium publishers are working successfully with plista in order to achieve outstanding content monetization, increased website stickiness and sustainable traffic growth. Our modern office is in the center of Berlin with an easy access to public transport. People from all over the world work for plista, we cover over 33 different nationalities.If we cought your interest, please apply over our carreer page or visit our website to find out more about plista: www.plista.com/career/Dear headhunters!!! We find our talents on our own, we are not interested in a coorporation in recruiting. Please don't send us unrequested CVs. Thank you for your understanding.Show moreShow lessSeniority levelEntry levelEmployment typeFull-timeJob functionEngineeringInformation TechnologyIndustriesMarketing and AdvertisingComputer SoftwareInternet","Berlin, Berlin, Germany",plista,2021-05-10,29 applicants,Marketing and Advertising,Computer Software,Internet,Full-time,Engineering,Information Technology,Entry level
4,2398555706,Data Scientist / Data Analyst (m/w/d),"Zur Verstärkung unseres Analystenteams in der EMPIT Factory am Standort Hamburg suchen wir einen Data Scientist / Data Analyst (m/w/d) für die Auswertung komplexer Inspektionsdaten. Ausgezeichnet als eines von Deutschlands 100 innovativsten Unternehmen im Mittelstand, bieten wir Ihnen einen sicheren, langfristigen und abwechslungsreichen Arbeitsplatz. Arbeiten Sie in einem jungen und dynamischen Unternehmen im Bereich Deep-Tech / High-Tech. Unsere Hardware- und Softwarelösungen werden weltweit für die Inspektion von Rohrleitungen in der Energie- und Wasserbranche eingesetzt. Für uns steht es im Vordergrund unsere Umwelt durch Technologie zu schützen. Als Data Scientist arbeiten Sie mit unseren gesammelten Inspektionsdaten. Ihre Analysen und Beurteilungen sind ein entscheidender Teil der Wertschöpfung für unsere Kunden. Ihre Tätigkeit: Sie verwalten, integrieren und analysieren die großen, komplexen Datenmengen, welche von unseren Inspektionsteams mit unserer einzigartigen Technologie aufgezeichnet wurden.Computerbasiert und selbstständig analysieren Sie alle visuellen, graphischen und numerischen Daten auf Auffälligkeiten und Muster.Wir schulen Sie im Umgang mit EMPITs eigenen Softwarelösungen. Komplexität und Verantwortung der von Ihnen übernommenen Analysen erweitern wir sukzessive.Dabei verknüpfen Sie auch Parameter in den aufgezeichneten Rohdaten mit weiteren Erkenntnissen wie Satelliten-, GPS-, Bild-, Ton- und Kartendaten.Sie arbeiten mit an der Erstellung unserer Inspektionsberichte. Ihr Profil: Sie verfügen über eine sehr analytische, verantwortungsvolle, konzentrierte und präzise Arbeitsweise. Dabei kontrollieren Sie Ihre Arbeit laufend selbstständig.Erkenntnisse, Fehler und Vorschläge diskutieren Sie aktiv mit Ihren Kollegen.Belastbarkeit und eine gewisse Flexibilität helfen Ihnen auch bei knappen Zeitplänen die Ruhe zu bewahren.Sie haben ein Studium in Data Science, der Physik, Mathematik, Informatik, Statistik, Elektrotechnik, Ingenieurswissenschaften oder eine vergleichbare Ausbildung erfolgreich abgeschlossen.Kenntnisse im Bereich der analogen und digitalen SignalverarbeitungErfahrung mit der Auswertung großer Datenmengen wünschenswertErfahrung mit der Interpretation von (elektromagnetischen) Messdaten wünschenswertGute Deutsch- und Englischkenntnisse in Wort und Schrift Was wir Ihnen bieten: Einen modernen und sicheren ArbeitsplatzFachliche und berufliche EntwicklungspotenzialeDie Einbindung in ein breit aufgestelltes, interdisziplinäres Team, mit flacher Hierarchie und kurzen EntscheidungswegenEine familiäre Unternehmenskultur eines international tätigen und stetig wachsenden High-Tech-UnternehmensEin modernes Büro, wo gern auch mal ein Feierabendbier getrunken wird Wenn wir Ihr Interesse geweckt haben, dann melden Sie sich bei uns und werden Sie fester Teil unseres Teams. Wir freuen uns auf Ihre Bewerbung mit Gehaltswunsch und frühestmöglichem Starttermin an: EMPIT GmbHFrau Franziska EhbrechtAlt Biesdorf 1112683 Berlincareer@empit.comwww.empit.comShow moreShow lessEmployment typeFull-time","Hamburg, Germany",EMPIT GmbH,2021-06-14,0,,,,Full-time,,,
0,2520449192,Data Scientist,"Our CompanyAt Boehringer Ingelheim we develop breakthrough therapies and innovative healthcare solutions in areas of unmet medical need for both humans and animals. As a family owned company, we focus on long-term performance. We believe that, if we have talented and ambitious people who are passionate about innovation, there is no limit to what we can achieve; after all, we started with just 28 people. Now, we are powered by 50,000 employees globally who nurture a diverse, collaborative and inclusive culture.THE POSITIONThe development of new treatment options for Neuropsychiatric Disorders is a key priority for Boehringer Ingelheim (BI). The CNS department at BI offers you the opportunity to contribute to cutting-edge neurotechniques in a dynamic, highly communicative and multicultural environment.We are looking for a Research scientist, responsible for the analysis of state of the art designed experiments within the CNS discovery department at BI.Discover our site Biberach: xplorebiberach.comTasks & ResponsibilitiesIn your new role you are responsible for the management and interpretation of complex amount of scientific data in close association with research scientists to ensure the appropriate data interpretation and infer complex data readouts.You participate in the scientific discussion in all aspects, from design, analyses, and interpretation of the data.As a Data Scientist you are accountable for the automatization and support of analysis of datasets from different sources such as EEG recordings, electrophysiological data including single-unit analyses, coherence analyses, fiber photometry analyses, network analysis from different data sources.You implement data representations and aggregations from multiple data sources.You process, analyze, and apply machine learning approaches on multidimensional neurophysiological data.Requirements Doctoral degree (e.g. PhD) in Pharmacology, Neuroscience, Medicine or related discipline  Several years of relevant professional experience  Extended knowledge of neurophysiology, demonstrated scientific knowledge in experimental electrophysiology and neural signal processing of neuronal activity datasets  Experience in modeling, biostatistics, and complex data analysis methods  Experience in programming & scripting skills, preferably in Python  Preferably an insight in the Neuropsychiatric field with some experience of Pharma Research & Development  Excellent oral communication skills as well as fluency in spoken and written English are mandatory, German an advantage EFFECTS OF COVID-19We will continue to hire talented people and we look forward to receiving your applications. As a result of COVID-19, we have introduced alternative working arrangements to ensure that our employees can stay safe and healthy, because the health of our employees is among our top priorities. At all company locations, we work remotely whenever possible. Additionally, we are now hosting virtual video interviews for applicants. During the limited in-person interviews we still have during this time, we pay special attention to distance and the hygiene rules recommended by the Robert Koch Institute. New employees who do not start on site in production or the laboratories are sent the necessary IT equipment, our Welcome Days take place online, and we plan to conduct their onboarding training virtually whenever possible.WHY BOEHRINGER INGELHEIM?This is where you can grow, collaborate, innovate and improve lives. We offer challenging work in a respectful and friendly global working environment surrounded by a world of innovation driven mindsets and practices. In addition, learning and development for all employees is key, because your growth is our growth. We also offer a competitive salary, generous amount of vacation time, and numerous benefits towards your wellness & financial health and work-life balance. Plus, an onsite gym (Ingelheim), in-house doctor and best-in-class cafeterias and coffee bars to keep you energized and healthy. To learn more about what benefits could be waiting for you, please visit our Career area .Want to learn more about us? Visit https://www.boehringer-ingelheim.com/Boehringer Ingelheim is an equal opportunity global employer who takes pride in maintaining a diverse and inclusive culture. We embrace diversity of perspectives and strive for an inclusive environment, which benefits our employees, patients and communities. All qualified applicants will receive consideration for employment without regard to race, color, religion, sex, sexual orientation, gender identity or national origin.READY TO CONTACT US? Please contact our Recruiting EMEA Team, Tel: +49 (0) 6132 77-173173Not exactly the position you are looking for but have someone else in mind? Share it via the button on the bottom of the page with friends or colleagues who might be interested.Job: Research & DevelopmentPrimary Location: Europe-DE-Baden Wuerttemberg-BiberachOrganization: DE-Boehringer Ingelheim Pharma GmbH&Co.KG (Germany)Schedule: Full-timeShow moreShow lessSeniority levelEntry levelEmployment typeFull-timeJob functionEngineeringInformation TechnologyIndustriesResearchBiotechnologyPharmaceuticals","Biberach, Baden-Württemberg, Germany",Boehringer Ingelheim,2021-06-14,0,Research,Biotechnology,Pharmaceuticals,Full-time,Engineering,Information Technology,Entry level
1,2506225023,Data Scientist (Labs),"PositionKAYAK is looking for people who love working with data and have a strong interest in machine learning systems, from recommender systems to reinforcement learning to vision to natural language processing. Good candidates will be well-versed in recent advances in machine learning and will be comfortable quickly testing and iterating on new ideas. Positions at different levels of seniority are available.KAYAK Labs, specifically, is a cross-cutting team focused on riskier projects and innovation across the business. Leveraging ML/AI, optimization, and our unique data assets, we aim for novel, impactful products and breakthrough improvements. We seek to distinguish our brand, to delight our users, and to help our customers experience the world through travel with confidence and peace-of-mind.As part of the Labs team, you’ll collaborate with strong researchers and engineers, and your work will have tangible impact. You will be challenged; you will have an opportunity to shape our business, and by extension, the wider travel industry. You will expand your competence and explore new technologies at the intersection of AI, data engineering, computation, and product delivery at scale.ResponsibilitiesFrame, design and execute your own solutions to modeling problems that will improve user experience and/or optimize key metrics important to the business. Conduct experiments and engage in rapid-prototyping of ideas, making creative use of the data and resources at your disposal. Implement designs in a stable, maintainable, and scalable production-ready form. Extract, process and leverage massive amounts of data to drive successful projects. Engage in group problem-solving, and collaborative team efforts. Communicate and share results in a clear and concise manner.QualificationsComfortable with math, statistics, systems design and coding to the extent necessary to tackle industrial machine learning and data science challenges. A PhD in a quantitative field (computer science, statistics, mathematics, operations research, science, engineering, etc.), is preferred and is a good indicator of sufficient preparation, but is not strictly required: what you can do (or quickly learn to do) is more important. Exposure to a minimum introductory level treatment of the core concepts and methods in machine learning, and some applied experience deploying those methods towards solving data science problems. Familiarity with current machine learning development ecosystems (Python, PyTorch / TensorFlow, Git, etc.) Comfortable collaborating in a dynamic, cross-functional team: you know how to listen, ask questions, build consensus, advocate (with data), and share success. You are willing to assume leadership and ownership over technological, business, or team responsibilities. Strong written and verbal communication skills: you can communicate clearly and effectively with peers and non-technical stakeholders alike. You can explain your plan for solving a business problem clearly, and document your work concisely.Bonus QualificationsWorking knowledge of advanced machine learning theory and methods, whether through experience or (graduate) coursework. Direct experience applying ML/AI in a business environment, and experience distilling high-level business challenges down to concrete modeling problems. Familiarity with bash scripting, relational databases. Familiarity with CI/CD tools and procedures, containerization, and horizontal scaling in latency sensitive ML-centric / production inference settings. Research publication track-record.About KAYAKAt KAYAK we help millions of travelers around the globe make confident travel decisions. KAYAK searches other sites to show travelers the information they need to find the right flights, hotels, rental cars and vacation packages and is the world's leading travel search engine.As an employee of KAYAK, you will be part of a global network that includes OpenTable and KAYAK's portfolio of metasearch brands including Swoodoo, checkfelix, momondo, Cheapflights, Mundi and HotelsCombined. Many employees are dedicated to one brand, but we all have the benefit of using each other's strengths and insights. Together, we're able to help people experience the world through dining and travel.KAYAK is part of Booking Holdings Inc. and operates sites in more than 60 countries and territories.Benefits And Perks6 weeks paid vacation Day off on your birthday Generous retirement plans Annual education budget * Free lunch catering three days per week * Public transportation subsidies * Free German classes * Free Yoga classes * Free massages from Wellnow * No stupid meetings Drinks, coffee, snacks, games etc Regular team events and volunteering opportunities Sport teams (Football, Volleyball, Basketball) Flexible hours In-house gym facilities Universal paid parental leave currently paused due to COVIDDiversity and Inclusion at OpenTable/ KAYAKWe aspire to have a workplace that reflects all of the diverse communities we serve. We know that when we have diverse teams we produce more innovative ideas, products, services, and better business outcomes for our stakeholders. OpenTable/KAYAK is proud to be an Equal Opportunity Employer and we welcome and encourage candidates from all backgrounds and experiences to apply for roles on our team. Whoever you are, just be you.We will ensure that individuals with disabilities are provided reasonable accommodation to participate in the job application or interview process, to perform essential job functions, and to receive other benefits and privileges of employment. Please contact us to request accommodation.Show moreShow lessSeniority levelEntry levelEmployment typeFull-timeJob functionEngineeringInformation TechnologyIndustriesInternetLeisure, Travel & TourismInformation Technology and Services","Berlin, Berlin, Germany",KAYAK,2021-09-14,56 applicants,Internet,"Leisure, Travel & Tourism",Information Technology and Services,Full-time,Engineering,Information Technology,Entry level
2,2403706286,Data Scientist (m/w/x),"Willkommen bei camparound. Vor vielen Jahren als Start-up gestartet, sind wir inzwischen eine Digitalagentur aus Köln, die sich zu 100 % dem Thema Camping verschrieben hat. Für unsere Muttergesellschaft Truma übernehmen wir zunehmend Verantwortung für digitale Themen. Das heißt, wir arbeiten nicht im schnelllebigen Projektgeschäft, sondern in einem mehrjährigen Arrangement mit einem deutschen Mittelständler. Dadurch können wir etwas Einzigartiges bieten: Bei uns sind die starken Methoden einer Agentur, der Vibe eines Start-ups und die Sicherheit eines deutschen Mittelständlers kombiniert. The perfect place to work! Wir arbeiten in kleinen, crossfunktionalen Teams, mit kurzen Entscheidungswegen und einer hohen Eigenverantwortung. Extreme Ownership und Agilität sind nicht nur leere Worthülsen, sondern werden von Praktikanten bis hin zur Geschäftsführung gelebt.  Wir suchen einen Data Scientist (m/w/x). Für uns bedeutet Data Scientist, dass Du sowohl in der Lage sein solltest, Daten korrekt zu erheben und vorzubereiten (Data Engineering) als auch ihren Sinn zu interpretieren und Hypothesen zu überprüfen (Data Analyst). Zusätzlich verstehst Du Unternehmens-Strategie und weißt, was die richtigen Fragen sind, die ein erfolgreiches Unternehmen stellen muss, kannst überprüfbare Hypothesen aufstellen und Deine Entscheidungen auch Nicht-Technikern erklären. Deine Aufgabe wird es sein, das Data Science Team zu gründen, aber wir lassen Dich nicht allein – abhängig von Deinen Stärken oder Schwächen und den Projektanforderungen werden wir Dir noch weitere Fachleute zur Seite stellen. Das bringst Du mit:Exzellente Fähigkeiten in der Modellbildung und Datenanalyse (Predictive und Prescriptive Analytics)Ein ausgeprägtes Interesse für Themen rund um IoT, WoT, Service 4.0 Die Bezeichnung „Smart Camper” zündet bei Dir ein Feuerwerk an IdeenDu kannst explorative Datenanalysen zur Entwicklung von nachhaltigen Strategien im Digitalmarkt erstellenEine Implementierung von skalierbaren Analysen auf verteilten Systemen (z. B. mit Spark, scikit learn, TensorFlow, Firebase) ist für Dich StandardDu verstehst sowohl SQL als auch NoSQL Datenbanken und weißt, was JOINS sindDer Betreuung und Umsetzung der Data Science-Projekte, von der Analyse bis zum Rollout, also “Data Science to Business Case”, siehst Du verantwortungsvoll entgegen Das wünschen wir uns zudem:Du kannst ein abgeschlossenes Studium der Informatik, Mathematik, Physik und bereits mehrere Jahre Berufserfahrung in der Datenanalyse bzw. im Machine Learning-Bereich vorweisenDu bist qualifiziert in mindestens zwei der folgenden Schwerpunkte:Social ListeningFeature EngineeringText MiningComputer VisionArtificial IntelligenceDeep LearningModellbildungDu bist ein Talent in Analyse, Bewertung und prägnanter Darstellung komplexer Sachverhalte sowie strukturierter und unstrukturierter Daten zur Entwicklung datengetriebener LösungenDu hast Kenntnisse und praktische Erfahrungen in agilen ProjektmanagementmethodenDu besitzt optimalerweise Kenntnisse im Umgang mit IBM CognosDu bist bereit, für die Unternehmensziele und die unserer Kunden zu reisen - Mobilität und Flexibilität für die Projektarbeit bei unseren Kunden vor Ort sind daher obligatDu hast Dich bereits mit Big Data aus der Automobilbranche befasstDu bist verhandlungssicher in Englisch und auch eine Präsentation bereitet dir keine Schwierigkeiten Was bieten wir Dir?Du wirst Teil der innovativen Community, die Camping und Outdooraktivitäten seit Jahren umkrempelt und noch viel vorhatEine offene und faire Kultur die persönliches Wachstum aktiv fördert und deine Gesundheit schütztEine hervorragende VergütungEin fantastisches Büro mitten in Köln-Ehrenfeld Wir haben dein Interesse geweckt?Dann bewirb dich jetzt! Bewerbungsende ist der 31.03.2021Show moreShow lessEmployment typeFull-time","Cologne, North Rhine-Westphalia, Germany",Camparound GmbH & Co. KG,2021-06-14,0,,,,Full-time,,,
