,id,job_title,description,location,employer,date_posted,n_applicants,industries,industries_1,industries_2,employment_type,job_function,job_function_1,seniority_level
3,2542266767,Data Analyst (m/w/d),"PAYBACK ist weltweit einzigartig im datenbasierten Marketing. Mit der Fähigkeit, digitale Geschäftsmodelle zu entwickeln und technische Trends umzusetzen, sind wir Vorreiter der Data Economy. Alle technischen Lösungen rund um das PAYBACK Programm werden in München erfunden und verwirklicht. Dafür arbeiten wir mit den neuesten Technologien cross-functional und agil.Du hast Lust Verantwortung zu übernehmen, deine Ideen rund um unser einzigartiges Produkt einzubringen und PAYBACK mit uns weiterzuentwickeln? Dann bist du hier genau richtig. NATÜRLICH leben wir Vielfalt nicht nur. Wir feiern sie! Machst du mit? Wir freuen uns auf dich.Aufgrund der aktuellen Situation (Covid-19) empfehlen wir allen Kollegen von ihrem zu Hause in Deutschland zu arbeiten.DEINE AUFGABEDu bist für die analytische Betreuung von einem oder mehreren PAYBACK Partner zuständigDu analysierst komplexe Partnerdaten mit dem Ziel, unsere Partner sowohl bei operativen als auch bei strategischen Fragestellungen bestmöglich zu beratenDu entwickelst Vorschläge zur Optimierung der Partnerkampagnen und zeigst neue Potentiale aufDu erstellst Ad Hoc Analysen und kanalübergreifende KampagnenauswertungenDu dienst als Schnittstelle zu Marketing, Partner Management und Vertriebssteuerung und unterstützt diese bei PartneranfragenDu entwickelst Scoring-Modelle und KundensegmentierungenDEIN PROFILDu hast ein erfolgreich abgeschlossenes Studium mit quantitativem SchwerpunktDu hast idealerweise mindestens 2 Jahre Berufserfahrung als Data Analyst, Business Analyst oder Data ScientistDu besitzt gute Anwendungskenntnisse in SQL, SAS, Python und RDu besitzt exzellente analytische Fähigkeiten und hast ein hohes Verständnis für DatenstrukturenDu bist ein Organisationstalent und behältst auch in heißen Phasen einen kühlen KopfDu bist proaktiv, innovativ, kreativ und ein TeamplayerDich zeichnen eine hohe Eigenmotivation, Durchsetzungsvermögen sowie sehr gute kommunikative Fähigkeiten ausDeine Deutsch- und Englischkenntnisse sind sehr gut (C1-Level)UNSER ANGEBOTWir erwarten Außergewöhnliches - in jeder Beziehung. Dafür motivieren wir mit Außergewöhnlichem - in jeder Beziehung.(Covid-19 bedingte Einschränkungen sind möglich)Du findest bei uns individuelle Entwicklungs- und WeiterbildungsmöglichkeitenWir haben ein tolles Team mit vielen schlauen KöpfenKostenlose Getränke, Obst, unser ESSZIMMER mit kulinarischen Leckereien aus Bella Italia sowie unsere 24/7 TURNHALLE versüßen dir den Arbeits-AlltagDank Jobticket kommst du kostenfrei ins Büro, die U-Bahn fährt dich direkt vor unsere HaustürIm SPIELZIMMER mit Bällebad und XBOX kannst du dir dein Feierabendbier oder ne Limo gönnenInformationRef: PB21_33Unternehmen: PAYBACK GmbHEinstieg als: ProfessionalsStandort: MünchenTätigkeit: Data Analyst (m/w/d)Berufsfeld: Analytics & Customer InsightsShow moreShow lessSeniority levelEntry levelEmployment typeFull-timeJob functionInformation TechnologyIndustriesMarketing and AdvertisingInformation Technology and ServicesInternet","Munich, Bavaria, Germany",PAYBACK,2021-05-10,0,Marketing and Advertising,Information Technology and Services,Internet,Full-time,Information Technology,,Entry level
4,2534567561,Data Analyst (m/w/d),"Wir glauben daran, dass die Zukunft denen gehört, die Innovation antreiben, die Wandel gestalten und die durch Zusammenarbeit vernetzen. Darum verbindet Modis die Schlüsseltechnologien IT, Engineering und Life Sciences, um gemeinsam mit unseren Kunden die Lösungen der Zukunft zu entwickeln. Wir bringen auf der ganzen Welt Top-Unternehmen mit den klügsten Köpfen im Engineering zusammen. Sie alle brennen dafür, ihre Talente für die herausforderndsten Aufgaben von heute und morgen einzusetzen. Sie auch?Dann suchen wir Sie als Data Analyst (m/w/d) im Bereich Informationsmanagement und Logistik für einen Kunden im Norden von München in Direktvermittlung.Was Sie bei uns bewirkenZu Ihren Aufgaben gehört die Durchführung und Entwicklung von Analyse von internen und externen Anforderungen im Bereich der Logistik und IT, sowie die Weiterentwicklung der (Data-) Infrastruktur zur Umsetzung logistischer Geschäftsprozesse und relevanter Unternehmens-Strategien Sie definieren und konzipieren Anforderungen an das Datenmaterial und unterstützen bei der Weiterentwicklung der (Daten-) Infrastruktur im Bereich Business Intelligence Für die Entwicklung und Durchführung von Analysen für logistische Geschäftsprozesse sowie Präsentation der Analyseergebnisse vor unterschiedlichen Zielgruppen sind Sie zuständig Sie arbeiten an IT-Projekten in einem interdisziplinären Team und übernehmen die Schnittstellenfunktion zwischen internen Fachbereichen, Kunden und Support-/Entwicklungsteam Was Sie dafür mitbringenSie haben Ihr Studium im Bereich (Wirtschafts-)Informatik, Wirtschaftsingenieurwesen oder eine vergleichbare Ausbildung erfolgreich abgeschlossen Sie konnten bereits mindestens 3 Jahre Berufserfahrung im Bereich Business Intelligence und/oder Data-Analyst eines Logistik-/Speditionsunternehmens sammeln Sie bringen routinierte Kenntnisse in SQL und idealerweise auch in Qlik mit  Ihre Deutsch- und Englischkenntnisse sind verhandlungssicher  Hohe Kommunikations- und Präsentationsstärke, ein sicheres Auftreten, Durchsetzungsvermögen und hohe IT-Affinität runden Ihr Profil ab  Warum Sie bei uns genau richtig sindFür uns beginnt der gemeinsame Weg damit, Ihre Ambitionen zu verstehen. Zusammen arbeiten wir daran, Sie an Ihr berufliches Ziel zu bringen.Bei Modis arbeiten Sie für eine dynamische, global ausgerichtete Marke, die in einem Schlüsselmarkt ambitionierte Ziele verfolgt.Sie können es kaum erwarten, uns kennenzulernen? Dann klicken Sie für den direkten Weg zu uns auf den Button ""JETZT BEWERBEN""Wir freuen uns über die Bewerbung von Menschen, die zur Vielfalt unseres Unternehmens beitragen.Gesundheit und Sicherheit haben für uns bei allen Tätigkeiten höchste Priorität - in der aktuellen Situation umso mehr. Wir und unsere Kunden beraten uns kontinuierlich mit Medizin- und Gesundheitsexperten und treffen in unseren Gebäuden und Geschäftsräumen alle empfohlenen Vorsichtsmaßnahmen, um die Gesunderhaltung unserer Mitarbeiter/innen und aller anderen Menschen zu gewährleisten.Ihr KontaktFrau Susanne UnterholznerModis GmbHEngineeringMesserschmittstraße 780992 MünchenTelefon +49 89/357751-167www.modis.comShow moreShow lessSeniority levelEntry levelEmployment typeFull-timeJob functionInformation TechnologyIndustriesInformation Technology and ServicesAutomotiveStaffing and Recruiting","Munich, Bavaria, Germany",Modis,2021-05-12,0,Information Technology and Services,Automotive,Staffing and Recruiting,Full-time,Information Technology,,Entry level
0,2510094659,(Junior) Data / BI Analyst (m/w/d),"(Junior) Data / BI Analyst (m/w/d) We, GamesGroup, are an international publishing and marketing partner for independent-minded, midsize development studios of cross-platform (PC/Mobile) free2play games. The developers create and own their games – we market and scale them and cover all administrative and legal aspects of the commercialization, effectively being the developer’s outsourced commercial department. The online/mobile games industry continues to be one of the fastest growing markets worldwide, highly competitive and fast-paced. Technical and gameplay innovations are two of the key drivers that ensure the ongoing expansion of players. We are always looking for talented, dedicated and open-minded colleagues, who want to join and shape our future, who are as enthusiastic as we are to do our part in creating fans for the games of which are proud to be a part of and to be a real partner to our developers. Throughout all phases, Analytics is the backbone of our company – from ingame behaviors to KPI driven marketing, Analytics provides the background for other departments, our operations and decisions. The position is a maternity replacement and, in the beginning, limited to 1 years.Your responsibilities: Translate our games into numbers and provide feedback. Managing, enhancing and controlling of our analytics system. Handling tracking solutions and various data sources; merge, sort and interpret data, make data readable and usable. Developing dashboards, models and forecasts, standard and ad-hoc reports. Work with the product team on game and user analysis. Provide decisive metrics to the marketing team. Be a proactive part of the analytics team. What you bring to the table: Degree in Mathematics, Physics, Computer Science, Statistics or similar field with mathematical/analytical focus or similar experience / education. Experience in setting up and maintaining data visualization tools (preferably Tableau). Experience in scripting language (preferred Python). First experience in working with Databases/RDMS (preferred MySQL and PostgreSQL). Very good Excel Skills. Analytical, number-driven mindset and detail-oriented and accurate work style. Good communication skills, confidence in presenting numbers and evaluations to the team and to developers. Very good written and spoken English (German optional). What we offer: An opportunity to join the games industry and start a career in this industry. An exciting, international role in a fascinating market. Working on exciting games with newest markets trends and in a fast-paced environment. A great team with international and highly educated colleagues. Autonomy and excellent opportunities for development in a highly dynamic team. An outstanding working atmosphere with flat hierarchies. Working in a flexible, open minded company where transparency is key. An office in the heart of Munich. Relocation support if needed. Other fringe benefits (incl. flexible working hours, partially remote working possible, local transport ticket, contributions to pension fund, monthly company lunch and more). Interested? Apply via the application button.Agency calls are not appreciated.Show moreShow lessSeniority levelEntry levelEmployment typeFull-timeJob functionAnalystIndustriesMarketing and Advertising","Munich, Bavaria, Germany",GamesGroup,2021-09-14,102 applicants,Marketing and Advertising,,,Full-time,Analyst,,Entry level
1,2546292972,Data Analyst / Scientist (m/f/div),"[ ](http://www.flocert.net/) Fair global trade everyone can believe in FLOCERT is a leading global assurance provider. Besides providing sole certification to Fairtrade, FLOCERT also offers an array of services to support companies in sourcing on Fairtrade principles, where no Fairtrade Standard applies. Founded in 2003, FLOCERT remains mission-driven and dedicated to working with all types of organisations, from small producers to internationally recognised brands, in order to promote fairness in global trade. Our accreditation as a “Social Enterprise” demonstrates our commitment to social business values. With six international offices conducting business in over 120 countries, FLOCERT specialises in offering global reach with local expertise. For more information, visit us at flocert.net FLOCERT is currently looking for aData Analyst / Scientist (m/f/div) *full-time*Job Share: Full-time (38,5 hrs. p.w.)Position is based in the FLOCERT GmbH Office in Bonn, GermanyThe salary and benefit package depends upon qualifications and experienceStart date:1st of July 2021* (or as soon as possible)DescriptionFLOCERT is looking for a person to drive research, development, and improvement of our assurance and information products; one that will support internal data analytic and our digital future. Your aim will be to highlight business opportunities/improvements and bring more data driven solutions and decision making into our core assurance service. The ability to analyse data sources, to be inquisitive and creative with data; to connect data models to business needs to highlight its potential; to be able to present complex topics and information in a meaningful manner to a wide range of audiences is a must for this role! You will need to liaise with multicultural teams and partners to develop concepts, dashboards, data models for both our internal and external customers, whilst continually innovating our business processes, our understanding of data and its future potential. ResponsibilitiesResearch new trends and techniques relating to data (e.g. r, machine learning, AI, predictive analytics).Assess potential partners and incubate early stages of development before handing over to an operational unit.Research and develop FLOCERTs assurance, supporting data sets and information products.Lead the development of data services, its supporting infrastructure and information tools.Understand and model FLOCERT’s data in terms of variables, indices and hierarchies.Act as adviser on data related questions and highlight business opportunities together with the potential to innovate and leverage our data.Manage the design, development, and customization of concepts, dashboards, reports, and information services/processes together with internal and external partners.Gather, analyse, and document business needs and related functionalities.Support the integration of core FLOCERT data according to departmental needs and conceptual models.Support FLOCERT’s data governance.Support with ad-hoc (non-standard) data requests. Qualifications *“Must haves”*University Degree in Economics, Business, data science, computing, mathematics or IT.2 years of relevant professional work experience as business/data; analyst/data scientist.Relevant experience in Business Intelligence / Presentation tools (Such as Power BI & Qlik).Project management experience.Experience with SQL Databases, data preparation and data analysis.Very good knowledge of MS Office.Curiosity and passion for data analysis and modelling.Strong analytical skills and data affinity (modelling and analysis).A pragmatic - solution oriented spirit.Strong dedication towards customer service.Good communication skills and ability to present technical matters in a comprehensible way also to non-technical colleagues.Positive attitude and ability to work independently (Being the expert).Team player with excellent interpersonal skills working in an intercultural working environment.Fluent in English oral and written.Motivation for Fairtrade and sustainability *“Nice to have”*Technical knowledge of assurance, certification, international trade or supply chains.Knowledge of sustainability and human rights.Working experience in process analysis, optimization and/or harmonization.Understanding of Python and/or R Linear regression / statistics.Fluency in additional languages, ideally Spanish, and/or French, German, Portuguese, Italian. How to apply Please apply by clicking the button “APPLY NOW!” and submit your application documents in English, with curriculum vitae, reference letters or reference contact data as well as a motivation letter with salary indication.[APPLY NOW](https://www.flocert.net/about-flocert/careers/?yid=505&sid=817a5970f0e52aa3abd6899c02db8805&af=1)For more information, visit us at [www.flocert.net](http://www.flocert.net)Show moreShow lessSeniority levelEntry levelEmployment typeFull-timeJob functionInformation TechnologyIndustriesInformation Technology and ServicesStaffing and RecruitingHuman Resources","Bonn, North Rhine-Westphalia, Germany",FLOCERT,2021-05-12,0,Information Technology and Services,Staffing and Recruiting,Human Resources,Full-time,Information Technology,,Entry level
2,2515418755,Data Analyst (m/w/d),"Zur Verstärkung unseres Analystenteams suchen wir einen Data Analyst (m/w/d) für die Auswertung komplexer Inspektionsdaten. Arbeiten Sie in einem jungen und dynamischen Unternehmen im Bereich Deep-Tech / High-Tech. Unsere Hardware- und Softwarelösungen werden weltweit für die Inspektion von Rohrleitungen in der Energie- und Wasserbranche eingesetzt. Für uns steht es im Vordergrund unsere Umwelt durch Technologie zu schützen. Als Data Analyst arbeiten Sie mit unseren gesammelten Inspektionsdaten. Ihre Analysen und Beurteilungen sind ein entscheidender Teil der Wertschöpfung für unsere Kunden. Ihre Tätigkeit: Sie verwalten, integrieren und analysieren die großen, komplexen Datenmengen, welche von unseren Inspektionsteams mit unserer einzigartigen Technologie aufgezeichnet wurden.Computerbasiert und selbstständig analysieren Sie alle visuellen, graphischen und numerischen Daten auf Auffälligkeiten und Muster.Wir schulen Sie im Umgang mit unseren Softwarelösungen. Komplexität und Verantwortung der von Ihnen übernommenen Analysen erweitern wir sukzessive.Dabei verknüpfen Sie auch Parameter in den aufgezeichneten Rohdaten mit weiteren Erkenntnissen wie Satelliten-, GPS-, Bild-, Ton- und Kartendaten.Sie arbeiten mit an der Erstellung unserer Inspektionsberichte. Ihr Profil:Sie verfügen über eine sehr analytische, verantwortungsvolle, konzentrierte und präzise Arbeitsweise. Dabei kontrollieren Sie Ihre Arbeit laufend selbstständig.Erkenntnisse, Fehler und Vorschläge diskutieren Sie aktiv mit Ihren Kollegen.Belastbarkeit und eine gewisse Flexibilität helfen Ihnen auch bei knappen Zeitplänen die Ruhe zu bewahren.Sie haben ein Studium bzw. eine Ausbildung im Bereich Data Analysis, der Physik, Mathematik, Informatik, Statistik, Elektrotechnik, Ingenieurswissenschaften oder eine vergleichbare Ausbildung erfolgreich abgeschlossen.Kenntnisse im Bereich der analogen und digitalen SignalverarbeitungErfahrung mit der Auswertung großer Datenmengen wünschenswertErfahrung mit der Interpretation von (elektromagnetischen) Messdaten wünschenswertGute Deutsch- und Englischkenntnisse in Wort und Schrift Was wir Ihnen bieten:Einen modernen und sicheren ArbeitsplatzFlexible ArbeitszeitmodelleGeförderte Fort- und WeiterbildungsmaßnahmenKarriere- und Entwicklungschancen in einem jungen, schnell expandierenden und international tätigen High-Tech UnternehmenDie Einbindung in eine familiäre Unternehmenskultur, mit einem breit aufgestellten, interdisziplinären Team, mit flacher Hierarchie und kurzen EntscheidungswegenModerne Büros, wo gern auch mal ein Feierabendbier getrunken wird Wenn wir Ihr Interesse geweckt haben, dann melden Sie sich bei uns und werden Sie fester Teil unseres Teams. Wir freuen uns auf Ihre Bewerbung mit Gehaltswunsch und frühestmöglichem Starttermin an:InspectorX GmbHcareer@inspectorx.comwww.inspectorx.comShow moreShow lessEmployment typeFull-time","Hamburg, Germany",InspectorX,2021-08-14,29 applicants,,,,Full-time,,,
3,2498062647, Data Analyst (Consumer) (f/m/d),"Direct message the job poster from BKK Beiersdorf AGRonald Greens--At Beiersdorf holistic consumer journeys and personalized consumer experience are our ambitions and data/analytics is the key to it. Change in that area has never moved this fast and will never be as slow again. We are looking for an analytical and data affine person working with us in an international environment with a passion for data driven marketing and consumer experience.Your TasksAs part of Beiersdorf’s Consumer Analytics Team located in the global Digital Acceleration Business Unit, your job is to setup and run a consumer data platform, integrating internal & external consumer signals. Furthermore, consult the different business teams on data driven product innovation and consumer engagement (communication) with measurable insights, supported by the Beiersdorf business & IT.Contribute to Beiersdorf’s consumer data strategy (1st/2nd/3rd party data) and take a leading role in the setup of an integrated consumer data/signals platform from business side, covering key consumer touchpoints (e.g. CRM, media, website, e-shop, service, etc.)Develop and manage processes that guarantee data integrity and validity as the owner of the harmonized data platform while closely collaborating with business service owners (e.g. CRM or precision marketing teams) and IT.Design analytical models to create or modify consumer journeys as well as provide recommendations to commercial strategies and tactics, including KPIs to determine successBe responsible for key aspects along the data modeling cycle from definition of business questions and hypotheses to data sourcing and preparation, model development and insight generation.Act as a global consultant for data driven product development & communication, giving “turn-key” analytics insights into respective data tribes on global, regional, and local (affiliates) levelYour ProfileMaster's degree in quantitative discipline (e.g. Statistics) or equivalent practical experienceExperience in advanced analytics. Domain expertise within the CPG industry or healthcare with a proven record of accomplishment in an analytics role is a plusExperience in attribution modeling, consumer segmentation & targeting, conversion modeling, journey optimization, simulation, and/or decision analysisComprehensive understanding of personalizing the consumer experience through programmatic media, CRM, e-commerce, and mobile apps from data generation to optimization is a plus, ideally with the Salesforce software stackStrong visualization skills with Power BI, R Shiny, Dash or similar technologies. Knowledge of JavaScript and JavaScript frameworks is a plusThe will to lie the analytical fundament by a proper data sourcing, preparation and integration process together with the ITExperience with SQL, Python and/or R to implement statistical analyses and machine learning modelsGood project management and consulting skills for successful project realizationFluent in English, both written and spokenShow moreShow lessEmployment typeFull-time","Hamburg, Germany",BKK Beiersdorf AG,2021-07-14,0,,,,Full-time,,,
